{
  "version": "1.0",
  "drawing_number": "PFD-100-001-PREVIEW",
  "view_id": "pfd-100-001",
  "sheet_size": "A1",
  "scale": 1,
  "symbol_scale": 1,
  "sheet_mm": {
    "width": 720,
    "height": 450
  },
  "objects": [
    {
      "object_id": "ffb52770-b258-ee8d-5375-05f6331da476",
      "tag": "R-101",
      "class": "Equipment",
      "bbox_mm": {
        "x": 12.356183594807895,
        "y": 101.51927978824543,
        "w": 56,
        "h": 64
      },
      "bbox_view": {
        "x": 0.017161366103899855,
        "y": 0.22559839952943428,
        "w": 0.07777777777777778,
        "h": 0.14222222222222222
      }
    },
    {
      "object_id": "e12d832b-e0cf-e6ce-2a18-7d9f363d1bdd",
      "tag": "R-102",
      "class": "Equipment",
      "bbox_mm": {
        "x": 32.42467720792325,
        "y": 193,
        "w": 56,
        "h": 64
      },
      "bbox_view": {
        "x": 0.04503427389989341,
        "y": 0.4288888888888889,
        "w": 0.07777777777777778,
        "h": 0.14222222222222222
      }
    },
    {
      "object_id": "a494fb13-c3cf-f93d-a39f-b056268951c5",
      "tag": "T-201",
      "class": "Equipment",
      "bbox_mm": {
        "x": 52.560984518951784,
        "y": 193,
        "w": 56,
        "h": 64
      },
      "bbox_view": {
        "x": 0.07300136738743303,
        "y": 0.4288888888888889,
        "w": 0.07777777777777778,
        "h": 0.14222222222222222
      }
    },
    {
      "object_id": "04650335-4c97-b0e6-2da6-cb79c9d24318",
      "tag": "T-202",
      "class": "Equipment",
      "bbox_mm": {
        "x": 72.69729182998026,
        "y": 193,
        "w": 56,
        "h": 64
      },
      "bbox_view": {
        "x": 0.10096846087497258,
        "y": 0.4288888888888889,
        "w": 0.07777777777777778,
        "h": 0.14222222222222222
      }
    },
    {
      "object_id": "2d1247be-117f-bc07-2172-01d1b87308d4",
      "tag": "T-203",
      "class": "Equipment",
      "bbox_mm": {
        "x": 92.83359914100876,
        "y": 193,
        "w": 56,
        "h": 64
      },
      "bbox_view": {
        "x": 0.12893555436251217,
        "y": 0.4288888888888889,
        "w": 0.07777777777777778,
        "h": 0.14222222222222222
      }
    },
    {
      "object_id": "954d95dd-1938-4a4f-1992-0d0f4c494215",
      "tag": "T-204",
      "class": "Equipment",
      "bbox_mm": {
        "x": 112.96990645203726,
        "y": 193,
        "w": 56,
        "h": 64
      },
      "bbox_view": {
        "x": 0.15690264785005176,
        "y": 0.4288888888888889,
        "w": 0.07777777777777778,
        "h": 0.14222222222222222
      }
    },
    {
      "object_id": "f12397b0-9462-2414-7dcc-698bcfe72ddc",
      "tag": "T-205",
      "class": "Equipment",
      "bbox_mm": {
        "x": 133.10621376306577,
        "y": 193,
        "w": 56,
        "h": 64
      },
      "bbox_view": {
        "x": 0.18486974133759135,
        "y": 0.4288888888888889,
        "w": 0.07777777777777778,
        "h": 0.14222222222222222
      }
    },
    {
      "object_id": "592be2f0-d6ef-7ebf-d994-16f870e2c187",
      "tag": "T-206",
      "class": "Equipment",
      "bbox_mm": {
        "x": 153.24252107409427,
        "y": 193,
        "w": 56,
        "h": 64
      },
      "bbox_view": {
        "x": 0.21283683482513094,
        "y": 0.4288888888888889,
        "w": 0.07777777777777778,
        "h": 0.14222222222222222
      }
    },
    {
      "object_id": "fb26af4e-4238-795d-8178-505e1be4501f",
      "tag": "T-207",
      "class": "Equipment",
      "bbox_mm": {
        "x": 173.37882838512277,
        "y": 193,
        "w": 56,
        "h": 64
      },
      "bbox_view": {
        "x": 0.24080392831267053,
        "y": 0.4288888888888889,
        "w": 0.07777777777777778,
        "h": 0.14222222222222222
      }
    },
    {
      "object_id": "c208826e-b4ef-85f7-0b0e-82f5a5e84c23",
      "tag": "T-208",
      "class": "Equipment",
      "bbox_mm": {
        "x": 193.51513569615128,
        "y": 193,
        "w": 56,
        "h": 64
      },
      "bbox_view": {
        "x": 0.2687710218002101,
        "y": 0.4288888888888889,
        "w": 0.07777777777777778,
        "h": 0.14222222222222222
      }
    },
    {
      "object_id": "99b22db9-880c-2c27-a765-c736eddbe0ce",
      "tag": "E-301",
      "class": "Equipment",
      "bbox_mm": {
        "x": 213.65144300717975,
        "y": 193,
        "w": 56,
        "h": 64
      },
      "bbox_view": {
        "x": 0.2967381152877496,
        "y": 0.4288888888888889,
        "w": 0.07777777777777778,
        "h": 0.14222222222222222
      }
    },
    {
      "object_id": "86c2781f-70e7-17b8-21ed-9e26d3122db4",
      "tag": "E-302",
      "class": "Equipment",
      "bbox_mm": {
        "x": 233.78775031820828,
        "y": 193,
        "w": 56,
        "h": 64
      },
      "bbox_view": {
        "x": 0.3247052087752893,
        "y": 0.4288888888888889,
        "w": 0.07777777777777778,
        "h": 0.14222222222222222
      }
    },
    {
      "object_id": "df6bdf70-f17c-0a97-f6e8-90cf373c146c",
      "tag": "E-303",
      "class": "Equipment",
      "bbox_mm": {
        "x": 253.92405762923676,
        "y": 193,
        "w": 56,
        "h": 64
      },
      "bbox_view": {
        "x": 0.3526723022628288,
        "y": 0.4288888888888889,
        "w": 0.07777777777777778,
        "h": 0.14222222222222222
      }
    },
    {
      "object_id": "1fe6c54f-8271-3795-98d4-af56faf012ef",
      "tag": "E-304",
      "class": "Equipment",
      "bbox_mm": {
        "x": 274.0603649402653,
        "y": 193,
        "w": 56,
        "h": 64
      },
      "bbox_view": {
        "x": 0.3806393957503685,
        "y": 0.4288888888888889,
        "w": 0.07777777777777778,
        "h": 0.14222222222222222
      }
    },
    {
      "object_id": "d9fde5e1-7ca7-e42f-e7af-dea2066b45b1",
      "tag": "E-305",
      "class": "Equipment",
      "bbox_mm": {
        "x": 294.19667225129376,
        "y": 193,
        "w": 56,
        "h": 64
      },
      "bbox_view": {
        "x": 0.408606489237908,
        "y": 0.4288888888888889,
        "w": 0.07777777777777778,
        "h": 0.14222222222222222
      }
    },
    {
      "object_id": "c86f31fe-8cab-2b7f-1a58-d64046a23a03",
      "tag": "E-306",
      "class": "Equipment",
      "bbox_mm": {
        "x": 314.3329795623223,
        "y": 193,
        "w": 56,
        "h": 64
      },
      "bbox_view": {
        "x": 0.4365735827254476,
        "y": 0.4288888888888889,
        "w": 0.07777777777777778,
        "h": 0.14222222222222222
      }
    },
    {
      "object_id": "83504d3a-c559-23ea-fd95-cbd157909b0d",
      "tag": "E-307",
      "class": "Equipment",
      "bbox_mm": {
        "x": 334.46928687335077,
        "y": 193,
        "w": 56,
        "h": 64
      },
      "bbox_view": {
        "x": 0.46454067621298717,
        "y": 0.4288888888888889,
        "w": 0.07777777777777778,
        "h": 0.14222222222222222
      }
    },
    {
      "object_id": "0c6c45d9-7580-4702-dc38-817881d75680",
      "tag": "E-308",
      "class": "Equipment",
      "bbox_mm": {
        "x": 354.60559418437924,
        "y": 193,
        "w": 56,
        "h": 64
      },
      "bbox_view": {
        "x": 0.49250776970052673,
        "y": 0.4288888888888889,
        "w": 0.07777777777777778,
        "h": 0.14222222222222222
      }
    },
    {
      "object_id": "8bf4f697-d672-4ae3-2546-58d4d149d135",
      "tag": "E-309",
      "class": "Equipment",
      "bbox_mm": {
        "x": 374.7419014954078,
        "y": 193,
        "w": 56,
        "h": 64
      },
      "bbox_view": {
        "x": 0.5204748631880664,
        "y": 0.4288888888888889,
        "w": 0.07777777777777778,
        "h": 0.14222222222222222
      }
    },
    {
      "object_id": "a7f36e9f-fe8a-f0c7-0d52-6ed0b10616ed",
      "tag": "E-310",
      "class": "Equipment",
      "bbox_mm": {
        "x": 394.87820880643625,
        "y": 193,
        "w": 56,
        "h": 64
      },
      "bbox_view": {
        "x": 0.5484419566756059,
        "y": 0.4288888888888889,
        "w": 0.07777777777777778,
        "h": 0.14222222222222222
      }
    },
    {
      "object_id": "adac84c5-1fc0-de03-375f-15420ad56045",
      "tag": "E-311",
      "class": "Equipment",
      "bbox_mm": {
        "x": 415.0145161174648,
        "y": 193,
        "w": 56,
        "h": 64
      },
      "bbox_view": {
        "x": 0.5764090501631455,
        "y": 0.4288888888888889,
        "w": 0.07777777777777778,
        "h": 0.14222222222222222
      }
    },
    {
      "object_id": "8ccaa031-b5fe-7253-425f-ffb7f78d59a9",
      "tag": "E-312",
      "class": "Equipment",
      "bbox_mm": {
        "x": 435.15082342849325,
        "y": 193,
        "w": 56,
        "h": 64
      },
      "bbox_view": {
        "x": 0.604376143650685,
        "y": 0.4288888888888889,
        "w": 0.07777777777777778,
        "h": 0.14222222222222222
      }
    },
    {
      "object_id": "d868aad9-ea7c-9f26-e93a-22178ebdc604",
      "tag": "P-401",
      "class": "Equipment",
      "bbox_mm": {
        "x": 455.2871307395218,
        "y": 193,
        "w": 56,
        "h": 64
      },
      "bbox_view": {
        "x": 0.6323432371382247,
        "y": 0.4288888888888889,
        "w": 0.07777777777777778,
        "h": 0.14222222222222222
      }
    },
    {
      "object_id": "144deac5-93d6-98b7-3d19-f07aad33d64a",
      "tag": "P-402",
      "class": "Equipment",
      "bbox_mm": {
        "x": 475.42343805055026,
        "y": 193,
        "w": 56,
        "h": 64
      },
      "bbox_view": {
        "x": 0.6603103306257643,
        "y": 0.4288888888888889,
        "w": 0.07777777777777778,
        "h": 0.14222222222222222
      }
    },
    {
      "object_id": "3a776f9c-d3ad-0040-c99b-694f62e0bf73",
      "tag": "P-403",
      "class": "Equipment",
      "bbox_mm": {
        "x": 495.55974536157873,
        "y": 193,
        "w": 56,
        "h": 64
      },
      "bbox_view": {